{
  "schemaVersion": 1,
  "id": "fixture.coreclronly",
  "catalogFingerprint": "E3B0C44298FC1C149AFBF4C8996FB92427AE41E4649B934CA495991B7852B855",
  "runtimeCompatibility": {
    "mode": "coreClr",
    "dependencyPackage": "Nanto.Plugin.Fixture.CoreClrOnly",
    "dependencyVersion": "1.0.0",
    "reason": "fixture-requires-coreclr"
  },
  "dependencies": [],
  "permissions": []
}
